{
  "version": "2.0.0",
  "defaultRegion": "WORLD",
  "notes": "Location-based grid intensity and the water consumed generating that electricity. Location-based is the default basis for carbon on purpose: market-based factors, which let a provider net off certificates bought elsewhere, flatter the result by three or four times. Electricity Maps is deliberately absent because its data is share-alike licensed and this repository is MIT. Off-site water is the weakest part of this file: the World Resources Institute publishes per-region factors and we have not yet transcribed them, so every region currently carries the same range built around the United States figure from Li and colleagues. Fixing that is the highest-value contribution anyone could make here.",
  "regions": [
    {
      "code": "WORLD",
      "name": "World average",
      "kind": "world",
      "continent": "Global",
      "gridGco2PerKwh": {
        "low": 435.6,
        "central": 458.5,
        "high": 483.2
      },
      "waterOffsiteLPerKwh": {
        "low": 3.37,
        "central": 4.81,
        "high": 7.21
      },
      "year": 2025,
      "source": {
        "title": "Yearly Electricity Data, full release, long format",
        "url": "https://storage.googleapis.com/emb-prod-bkt-publicdata/public-downloads/yearly_full_release_long_format.csv",
        "publisher": "Ember",
        "date": "2026",
        "retrieved": "2026-09-13",
        "licence": "CC BY 4.0"
      },
      "waterSource": {
        "title": "Guidance for Calculating Water Use Embedded in Purchased Electricity, Appendices 1 and 2 and Table 4",
        "url": "https://files.wri.org/d8/s3fs-public/guidance-calculating-water-use-embedded-purchased-electricity_0.pdf",
        "publisher": "World Resources Institute and WSP",
        "date": "2020-01",
        "retrieved": "2026-09-13",
        "licence": "CC BY 4.0"
      },
      "provenance": {
        "method": "fetched",
        "recorded": "2026-09-13"
      },
      "notes": "Power sector CO2 intensity, gCO2/kWh, from the Ember yearly release. Central is the latest full year; the range is the spread of the last three (2023: 483.2, 2024: 471.5, 2025: 458.5), widened where the latest year sits on an edge. Read from the CSV on 2026-09-13. Off-site water is the water consumed generating the electricity: 1.27 US gal/kWh from Table 4, the generation-weighted global average of the WRI guidance, at 3.785 L per gallon. The factor is a single modelled value from 2018 generation mixes, so the range takes 0.7 and 1.5 times it, to cover the shift in mix since and the gap between modelling approaches: Li and colleagues put the United States at 3.1 L/kWh where this method gives 3.14."
    },
    {
      "code": "US",
      "name": "United States",
      "kind": "country",
      "continent": "North America",
      "gridGco2PerKwh": {
        "low": 298.3,
        "central": 349.7,
        "high": 396.2
      },
      "waterOffsiteLPerKwh": {
        "low": 2.2,
        "central": 3.14,
        "high": 4.71
      },
      "year": 2023,
      "source": {
        "title": "eGRID2023 Summary Tables, revision 2, Table 1: subregion output emission rates",
        "url": "https://www.epa.gov/system/files/documents/2025-06/summary_tables_rev2.xlsx",
        "publisher": "United States Environmental Protection Agency",
        "date": "2025-06",
        "retrieved": "2026-09-13",
        "licence": "public domain"
      },
      "waterSource": {
        "title": "Guidance for Calculating Water Use Embedded in Purchased Electricity, Appendices 1 and 2 and Table 4",
        "url": "https://files.wri.org/d8/s3fs-public/guidance-calculating-water-use-embedded-purchased-electricity_0.pdf",
        "publisher": "World Resources Institute and WSP",
        "date": "2020-01",
        "retrieved": "2026-09-13",
        "licence": "CC BY 4.0"
      },
      "provenance": {
        "method": "fetched",
        "recorded": "2026-09-13"
      },
      "notes": "CO2e output emission rate from the U.S. total line of Table 1, 770.884 lb/MWh, converted at 0.45359237 g/kWh per lb/MWh. The range mirrors the national row's band, about six per cent under and seven over, which covers a typical year's movement between eGRID releases. Read from the spreadsheet on 2026-09-13. Off-site water is the water consumed generating the electricity: 0.83 US gal/kWh from Appendix 2 of the WRI guidance, at 3.785 L per gallon. The factor is a single modelled value from 2018 generation mixes, so the range takes 0.7 and 1.5 times it, to cover the shift in mix since and the gap between modelling approaches: Li and colleagues put the United States at 3.1 L/kWh where this method gives 3.14. The range is the real hourly spread of 2025: the 10th and 90th percentiles of hourly intensity in the gridcarbon snapshot for zone US (8760 intervals), taken as a fraction of that year's mean (0.853 and 1.133) and applied to the central figure above. The snapshot's own levels use lifecycle emission factors, so they are not used directly; only the shape of the year is taken. Its 2025 mean for this zone was 352.7 gCO2eq/kWh. Attribution the data licence asks for: gridcarbon hourly carbon intensity, CC BY 4.0, derived from the ENTSO-E Transparency Platform, the U.S. Energy Information Administration (EIA-930) and the NESO Carbon Intensity API, none of which endorse it.",
      "rangeSource": {
        "title": "gridcarbon, hourly grid carbon intensity for 45 zones (Europe, US, Great Britain), snapshot 2026-09-04",
        "url": "https://doi.org/10.5281/zenodo.22299989",
        "publisher": "gupeng, via Zenodo",
        "date": "2026-09-04",
        "retrieved": "2026-09-13",
        "licence": "CC BY 4.0"
      }
    },
    {
      "code": "IN",
      "name": "India",
      "kind": "country",
      "continent": "Asia",
      "gridGco2PerKwh": {
        "low": 680,
        "central": 710,
        "high": 745
      },
      "waterOffsiteLPerKwh": {
        "low": 2.41,
        "central": 3.44,
        "high": 5.16
      },
      "year": 2025,
      "source": {
        "title": "CO2 Baseline Database for the Indian Power Sector, version 21.0",
        "url": "https://cea.nic.in/cdm-co2-baseline-database/",
        "publisher": "Central Electricity Authority, Government of India",
        "date": "2025-12",
        "retrieved": "2026-09-10"
      },
      "waterSource": {
        "title": "Guidance for Calculating Water Use Embedded in Purchased Electricity, Appendices 1 and 2 and Table 4",
        "url": "https://files.wri.org/d8/s3fs-public/guidance-calculating-water-use-embedded-purchased-electricity_0.pdf",
        "publisher": "World Resources Institute and WSP",
        "date": "2020-01",
        "retrieved": "2026-09-13",
        "licence": "CC BY 4.0"
      },
      "provenance": {
        "method": "source-appendix",
        "recorded": "2026-09-10",
        "note": "0.710 tCO2 per MWh weighted average."
      },
      "notes": "Off-site water is the water consumed generating the electricity: 0.91 US gal/kWh from Appendix 2 of the WRI guidance, at 3.785 L per gallon. The factor is a single modelled value from 2018 generation mixes, so the range takes 0.7 and 1.5 times it, to cover the shift in mix since and the gap between modelling approaches: Li and colleagues put the United States at 3.1 L/kWh where this method gives 3.14."
    },
    {
      "code": "GB",
      "name": "United Kingdom (Ember, as generated)",
      "kind": "country",
      "continent": "Europe",
      "gridGco2PerKwh": {
        "low": 97.6,
        "central": 217.4,
        "high": 355.2
      },
      "waterOffsiteLPerKwh": {
        "low": 1.65,
        "central": 2.35,
        "high": 3.53
      },
      "year": 2025,
      "source": {
        "title": "Yearly Electricity Data, full release, long format",
        "url": "https://storage.googleapis.com/emb-prod-bkt-publicdata/public-downloads/yearly_full_release_long_format.csv",
        "publisher": "Ember",
        "date": "2026",
        "retrieved": "2026-09-13",
        "licence": "CC BY 4.0"
      },
      "provenance": {
        "method": "fetched",
        "recorded": "2026-09-13"
      },
      "notes": "Power sector CO2 intensity, gCO2/kWh, from the Ember yearly release. Central is the latest full year; the range is the spread of the last three (2023: 235.6, 2024: 216.5, 2025: 217.4), widened where the latest year sits on an edge. Read from the CSV on 2026-09-13. Off-site water is the water consumed generating the electricity: 0.62 US gal/kWh from Appendix 2 of the WRI guidance, at 3.785 L per gallon. The factor is a single modelled value from 2018 generation mixes, so the range takes 0.7 and 1.5 times it, to cover the shift in mix since and the gap between modelling approaches: Li and colleagues put the United States at 3.1 L/kWh where this method gives 3.14. The range is the real hourly spread of 2025: the 10th and 90th percentiles of hourly intensity in the gridcarbon snapshot for zone GB (17520 intervals), taken as a fraction of that year's mean (0.449 and 1.634) and applied to the central figure above. The snapshot's own levels use lifecycle emission factors, so they are not used directly; only the shape of the year is taken. Its 2025 mean for this zone was 129.2 gCO2eq/kWh. Attribution the data licence asks for: gridcarbon hourly carbon intensity, CC BY 4.0, derived from the ENTSO-E Transparency Platform, the U.S. Energy Information Administration (EIA-930) and the NESO Carbon Intensity API, none of which endorse it.",
      "waterSource": {
        "title": "Guidance for Calculating Water Use Embedded in Purchased Electricity, Appendices 1 and 2 and Table 4",
        "url": "https://files.wri.org/d8/s3fs-public/guidance-calculating-water-use-embedded-purchased-electricity_0.pdf",
        "publisher": "World Resources Institute and WSP",
        "date": "2020-01",
        "retrieved": "2026-09-13",
        "licence": "CC BY 4.0"
      },